{
  "observation_id": "01j4w4j0k7hm9j9tx3jz8s2n5q",
  "engine": "crawlee-cheerio",
  "engine_version": "fixture-1",
  "route_kind": "http",
  "state": "succeeded",
  "started_at": "2026-08-09T12:00:00Z",
  "completed_at": "2026-08-09T12:00:01Z",
  "http_status": 200,
  "final_url": "https://example.org/docs/",
  "quality": {
    "score": 0.93,
    "text_chars": 142,
    "word_count": 18,
    "requested_selectors_present": true,
    "challenge_detected": false,
    "schema_valid": true,
    "main_content_ratio": 0.86
  },
  "source_artifact_id": "01j4w4j8gv95v1x2n7e1ss6q61",
  "safe_diagnostics": {}
}
